{
  "schema_version": "0.1.0",
  "source_id": "src_b5e47f19b1df",
  "source_type": "note",
  "path": ".ditto/local/handoff/archive/wi_260606agx__2026-06-06T02-27-50-806Z.md",
  "content_hash": "260317278e8730b1b4d1b7f88054c3ff08dfe4a174f00e6cced72e6b7d878947",
  "captured_at": "2026-06-16T16:46:51.311Z",
  "revision": "f0b265ee45ff87f89ea344b41a164fbfc4928ad0",
  "git_commit": "f0b265ee45ff87f89ea344b41a164fbfc4928ad0",
  "sensitivity": "internal",
  "word_count": 140
}
