{
  "schema_version": "0.1.0",
  "source_id": "src_74f9b55bd594",
  "source_type": "note",
  "path": ".ditto/local/handoff/archive/wi_260613afv__2026-06-14T07-04-43-535Z.md",
  "content_hash": "34b1f0adc927b491be7ab69df1204cde3eb2138ac7e01917c478b39be941970b",
  "captured_at": "2026-06-16T16:46:51.311Z",
  "revision": "f0b265ee45ff87f89ea344b41a164fbfc4928ad0",
  "git_commit": "f0b265ee45ff87f89ea344b41a164fbfc4928ad0",
  "sensitivity": "internal",
  "word_count": 94
}
