{
  "schema_version": "0.1.0",
  "source_id": "src_57085a52ddb6",
  "source_type": "note",
  "path": ".ditto/local/handoff/archive/wi_26061304x__2026-06-14T07-56-02-144Z.md",
  "content_hash": "b180de6ad97ce1bc7cceb71b060c2b0a42f29c05e93f7bc31285ca3d038ca168",
  "captured_at": "2026-06-16T16:46:51.311Z",
  "revision": "f0b265ee45ff87f89ea344b41a164fbfc4928ad0",
  "git_commit": "f0b265ee45ff87f89ea344b41a164fbfc4928ad0",
  "sensitivity": "internal",
  "word_count": 141
}
